{
  "authoritative_ledger": "docs/governance/fixture-coverage.md",
  "authoritative_obligation_registry": "fixtures/obligation-profiles.json",
  "canonicalization": "sorted-pretty-json-v1",
  "coverage_semantics": "authoring-intent-only-not-coverage-evidence",
  "excluded_legacy_recipe_ids": [
    "assembly.box.nested_repeated_instances",
    "compound.box_pair.coincident",
    "compound.box_pair.shared_face_nonmanifold",
    "compound.free_edge_isolated_vertex",
    "shell.box.open",
    "solid.box",
    "solid.box.inner_void",
    "solid.cone.frustum",
    "solid.cylinder.full",
    "solid.cylinder.partial",
    "solid.plate.circular_through_hole",
    "solid.plate.two_circular_through_holes",
    "solid.prism.concave",
    "solid.prism.ellipse.full",
    "solid.prism.ellipse.partial_cap",
    "solid.sphere.segment",
    "solid.torus.segment"
  ],
  "recipe_count": 60,
  "recipe_modules": [
    "fixtures/generator/fixture_curve_recipes.cpp",
    "fixtures/generator/fixture_feature_recipes.cpp",
    "fixtures/generator/fixture_pathology_recipes.cpp",
    "fixtures/generator/fixture_surface_recipes.cpp",
    "fixtures/generator/fixture_topology_recipes.cpp",
    "fixtures/generator/fixture_trim_support_recipes.cpp"
  ],
  "recipes": {
    "baseline.pathology.box": {
      "independent_oracle_intent": "Freeze the valid 24 by 20 by 16 millimetre box dimensions, signed volume, topology identities, and imported baseline before any source-bound duplicate, orientation, or self-intersection mutation. The clean box alone must claim no pathology obligation.",
      "intended_obligation_ids": [],
      "intended_support_assignments": [],
      "module": "fixtures/generator/fixture_pathology_recipes.cpp",
      "title": "Clean box mutation baseline"
    },
    "baseline.pathology.planar_face": {
      "independent_oracle_intent": "Freeze the valid 30 by 20 millimetre rectangular face, its 600 square millimetre area, boundary identities, and imported baseline. Record the zero and near-zero mutation targets only as source parameters; the clean face is not zero-area evidence.",
      "intended_obligation_ids": [],
      "intended_support_assignments": [],
      "module": "fixtures/generator/fixture_pathology_recipes.cpp",
      "title": "Clean planar-face area baseline"
    },
    "baseline.pathology.wire_gap_thresholds": {
      "independent_oracle_intent": "Freeze two valid closed square wires, their ordered edge and vertex identities, and the one-micrometre source tolerance before source-bound gap mutations. The clean wires must not be reported as within-tolerance or beyond-tolerance gap cases.",
      "intended_obligation_ids": [],
      "intended_support_assignments": [],
      "module": "fixtures/generator/fixture_pathology_recipes.cpp",
      "title": "Clean wire-gap mutation baseline"
    },
    "component.mixed.supported_unsupported": {
      "independent_oracle_intent": "Independently enumerate every imported box edge and face, derive their line and plane equations, extract the residual B-spline tensor data, and assign every subject exactly once. The procedural oracle must require component mesh completion to fail while the residual region lacks a compatible strategy; native gate evidence remains separately required.",
      "intended_obligation_ids": [
        "SRF-007",
        "SRF-024",
        "SUP-001",
        "SUP-004",
        "SUP-010",
        "SUP-011"
      ],
      "intended_support_assignments": [
        {
          "selection_code": "reason.residual_surface_route_unproven",
          "state": "DeferredResidualSurface",
          "subject_scope": "the imported residual B-spline face and its logical region"
        },
        {
          "selection_code": "strategy.curve.exact_line",
          "state": "SupportedAnalyticTemplate",
          "subject_scope": "all imported straight box-edge subjects"
        },
        {
          "selection_code": "strategy.surface.planar",
          "state": "SupportedAnalyticTemplate",
          "subject_scope": "all imported planar box faces and their logical regions"
        }
      ],
      "module": "fixtures/generator/fixture_trim_support_recipes.cpp",
      "title": "Analytic box with a deferred residual patch"
    },
    "compound.face.coincident_overlap": {
      "independent_oracle_intent": "Derive three distinct planar-face identities, prove that two 18 by 12 millimetre faces are coincident, and calculate the third face's 72 square millimetre overlap from its offset. Keep coincidence, overlap, and free-face topology as separate findings.",
      "intended_obligation_ids": [
        "PAT-016",
        "SEM-022",
        "SUP-005"
      ],
      "intended_support_assignments": [
        {
          "selection_code": "reason.free_topology",
          "state": "UnsupportedTopology",
          "subject_scope": "all standalone coincident and overlapping face subjects"
        }
      ],
      "module": "fixtures/generator/fixture_feature_recipes.cpp",
      "title": "Coincident and partially overlapping planar faces"
    },
    "compound.free_wire_edge_vertex": {
      "independent_oracle_intent": "Derive the four-edge closed chain, two-edge open chain, independent edge, and isolated vertex from their coordinates, then verify imported incidence and root classes. Claim the wire variants only if their ordered incidence survives the STEP readback.",
      "intended_obligation_ids": [
        "SUP-005",
        "TOP-018"
      ],
      "intended_support_assignments": [
        {
          "selection_code": "reason.free_topology",
          "state": "UnsupportedTopology",
          "subject_scope": "all free wire, free edge, and isolated-vertex subjects"
        }
      ],
      "module": "fixtures/generator/fixture_topology_recipes.cpp",
      "title": "Free closed wire, open wire, edge, and vertex compound"
    },
    "compound.mixed.disconnected_face_wire": {
      "independent_oracle_intent": "Prove one isolated 12 by 9 millimetre rectangular face and one disconnected two-edge open chain from coordinates and imported incidence. Claim the wire-body portion only when the imported wire remains an addressable body.",
      "intended_obligation_ids": [
        "SUP-005",
        "TOP-015"
      ],
      "intended_support_assignments": [
        {
          "selection_code": "reason.free_topology",
          "state": "UnsupportedTopology",
          "subject_scope": "the disconnected standalone face and open-wire subjects"
        }
      ],
      "module": "fixtures/generator/fixture_topology_recipes.cpp",
      "title": "Disconnected planar face and open wire"
    },
    "compound.orientation.internal_external": {
      "independent_oracle_intent": "Record the four source edge occurrences and independently record every imported orientation. Do not claim the all-orientation obligation unless FORWARD, REVERSED, INTERNAL, and EXTERNAL all survive; the present authoring target is limited to the free-topology support decision.",
      "intended_obligation_ids": [
        "SUP-005"
      ],
      "intended_support_assignments": [
        {
          "selection_code": "reason.free_topology",
          "state": "UnsupportedTopology",
          "subject_scope": "all four free-edge occurrence subjects"
        }
      ],
      "module": "fixtures/generator/fixture_topology_recipes.cpp",
      "title": "Free-edge occurrence orientation feasibility matrix"
    },
    "compsolid.box_pair.shared_interface": {
      "independent_oracle_intent": "Independently require an imported COMPSOLID root containing two solids and exactly one face identity incident to both. Until that root type and shared identity survive the processing-disabled STEP readback, this recipe must make no TOP-002, non-manifold, or support-state claim.",
      "intended_obligation_ids": [],
      "intended_support_assignments": [],
      "module": "fixtures/generator/fixture_topology_recipes.cpp",
      "title": "Shared-interface compsolid feasibility case"
    },
    "face.bezier.matrix": {
      "independent_oracle_intent": "Extract each imported tensor degree, pole grid, rational flag, and weight grid, then independently evaluate tensor Bernstein samples at frozen interior parameters. Bind every observation to the corresponding face before assigning its open-face support state.",
      "intended_obligation_ids": [
        "SRF-006",
        "SRF-024",
        "SUP-005"
      ],
      "intended_support_assignments": [
        {
          "selection_code": "reason.free_topology",
          "state": "UnsupportedTopology",
          "subject_scope": "all standalone Bezier face subjects"
        }
      ],
      "module": "fixtures/generator/fixture_surface_recipes.cpp",
      "title": "Bezier surface degree and rationality matrix"
    },
    "face.bspline_nurbs.matrix": {
      "independent_oracle_intent": "Independently verify tensor degrees, poles, knots, multiplicities, weights, and periodic flags for every imported face, and compare fixed samples with a separate Cox-de Boor evaluation. Do not infer a structured map from the four-sided trim alone.",
      "intended_obligation_ids": [
        "SRF-007",
        "SRF-016",
        "SRF-024",
        "SUP-005"
      ],
      "intended_support_assignments": [
        {
          "selection_code": "reason.free_topology",
          "state": "UnsupportedTopology",
          "subject_scope": "all standalone B-spline and NURBS face subjects"
        }
      ],
      "module": "fixtures/generator/fixture_surface_recipes.cpp",
      "title": "B-spline and NURBS surface matrix"
    },
    "face.cylinder.seam_dual_pcurve": {
      "independent_oracle_intent": "Identify the imported cylindrical seam edge, derive both face p-curves, prove that their U coordinates differ by one period while mapping to the same 3D curve, and bind curve, range, tolerance, endpoint, and incidence observations. TOP-007 remains a procedural-lane contribution to its all-lane requirement.",